sno,h,sub_h,link
88,Road accidents in rural areas claim 127 in two months,The number of people dying in Road accidents in the rural parts of the district has reached an alarming level.,https://timesofindia.indiatimes.com/city/nashik/road-accidents-in-rural-areas-claim-127-in-two-months/articleshow/51578450.cms
89,"9 dead, 5 injured in Road accident in Belagavi",Nine people died and five others were injured in a major accident on Saturday evening on Pune-Bengaluru National Highway-4.,https://timesofindia.indiatimes.com/city/pune/9-dead-5-injured-in-road-accident-in-belagavi/articleshow/49433356.cms
90,Road accidents on the rise in Nashik,"The past four years have seen a consistent rise in the number of accidents, despite roads being widened in many parts of the city.",https://timesofindia.indiatimes.com/city/nashik/road-accidents-on-the-rise-in-nashik/articleshow/29622693.cms
91,Nearly 50% of Road accidents reported till June involved bikes,,https://timesofindia.indiatimes.com/city/navi-mumbai/nearly-50-of-road-accidents-reported-till-june-involved-bikes/articleshow/53745466.cms
92,3 persons killed in Road accidents,,https://timesofindia.indiatimes.com/city/nagpur/3-persons-killed-in-road-accidents/articleshow/43110798.cms
93,38 killed in 345 Road accidents this year,Widening and asphalting of roads across the city have not been able to curb the rising number of accidents taking place in Nashik.,https://timesofindia.indiatimes.com/city/nashik/38-killed-in-345-road-accidents-this-year/articleshow/46912975.cms
94,Man dies in Road accident,"A 45-year-old man was knocked dead and a senior citizen was seriously injured after a speeding truck hit their motorbike near Jalaram Temple, Quetta Colony, on Saturday afternoon.",https://timesofindia.indiatimes.com/city/nagpur/man-dies-in-road-accident/articleshow/29373212.cms
95,Three killed in Road accident on Pune-Satara road,A former director of the Defence Research and Development Organization (DRDO) and his neighbour couple were killed in an accident on the Pune-Satara road on Thursday afternoon.,https://timesofindia.indiatimes.com/city/mumbai/three-killed-in-road-accident-on-pune-satara-road/articleshow/49278592.cms
96,Victim’s bike ‘missing’ after Road accident,"City police are trying to unravel the mystery surrounding the missing bike of hit-and-run victim Rakesh Jha, who succumbed to injuries on September 29. An unidentified car was learnt to have hit Rakesh’s bike at Ramdaspeth on September 25. An injured Rakesh was rushed to a private hospital by the unidentified motorist who later sneaked away from the place without informing police about the accident.",https://timesofindia.indiatimes.com/city/nagpur/victims-bike-missing-after-road-accident/articleshow/49200302.cms
97,We are appealing against Salman verdict: Maharashtra govt tells HC,State government told Bombay high court on Wednesday that it has decided to appeal against the Salman Khan acquittal verdict.,https://timesofindia.indiatimes.com/city/mumbai/we-are-appealing-against-salman-verdict-maharashtra-govt-tells-hc/articleshow/50295599.cms
98,Cop killed in Road accident,"An assistant police inspector (API) attached to the Thane rural police died in a Road accident near Mankoli, Bhiwandi.",https://timesofindia.indiatimes.com/city/thane/cop-killed-in-road-accident/articleshow/28097346.cms
99,"More bikers, pedestrians died in Road accidents last year","More pedestrians and motorcyclists died in 2015 , under all 10 categories of Road accident victims, compared to 2014. Apart from losing lives under these two categories of road users in 2015, they also reported heavy casualties",https://timesofindia.indiatimes.com/city/navi-mumbai/more-bikers-pedestrians-died-in-road-accidents-last-year/articleshow/51111903.cms
100,"Woman killed, two hurt in Road accident",A woman among three persons travelling on a scooter died after a rashly driver four-wheeler dashed their two-wheeler at Sneh Nagar.,https://timesofindia.indiatimes.com/city/nagpur/woman-killed-two-hurt-in-road-accident/articleshow/46362166.cms
101,BARC scientist dies in Road accident,"A senior scientist of Bhabha Atomic Research Centre (BARC), Dr P M Pathak (45), was killed in a Road accident which took place in Trombay last night.",https://timesofindia.indiatimes.com/city/mumbai/barc-scientist-dies-in-road-accident/articleshow/38991861.cms
102,More deaths in Road accidents this year,"More people have died on city roads in the first six months of 2014, as compared to the same period last year.",https://timesofindia.indiatimes.com/city/nashik/more-deaths-in-road-accidents-this-year/articleshow/38893445.cms
103,"Two die in Road accident in Murbad; locals burn vehicle, block highway",Two people died while seven injured in a Road accident in which a passenger jeep collided with a container on National Highway number 222 near Murbad on Monday morning.,https://timesofindia.indiatimes.com/city/mumbai/two-die-in-road-accident-in-murbad-locals-burn-vehicle-block-highway/articleshow/39157207.cms
104,Road accidents claim 35 lives in state everyday!,"The number of fatalities in Road accidents has risen 12.2% since 2009. According to the Maharashtra police statistics, at least 35 people die in Road accidents across the state every day.",https://timesofindia.indiatimes.com/city/nagpur/road-accidents-claim-35-lives-in-state-everyday/articleshow/48243721.cms
105,"Nurse gives CPR to Road accident victim, saves life",A staff nurse at the NKP Salve Institute of Medical Sciences and Lata Mangeshkar Hospital saved the life of an accident victim by giving him Cardiac Pulmonary Resuscitation (CPR).,https://timesofindia.indiatimes.com/city/nagpur/nurse-gives-cpr-to-road-accident-victim-saves-life/articleshow/50079969.cms
106,Jump in Pune expressway Road accident deaths in first 6 months of 2016,,https://timesofindia.indiatimes.com/city/navi-mumbai/jump-in-pune-expressway-road-accident-deaths-in-first-6-months-of-2016/articleshow/53916057.cms
107,Maharashtra CM's wife involved in minor Road accident,"The Wife of Maharashtra CM, Amruta Fadnavis, was involved in a minor Road accident here.",https://timesofindia.indiatimes.com/city/mumbai/maharashtra-cms-wife-involved-in-minor-road-accident/articleshow/47395762.cms
108,Female motorist held for head-on collision on a Mumbai flyover killing the taxi driver,A taxi driver was killed after a Wagon R car jumped the divider and had a head-on collision on the JJ Flyover on Sunday.,https://timesofindia.indiatimes.com/city/mumbai/female-motorist-held-for-head-on-collision-on-a-mumbai-flyover-killing-the-taxi-driver/articleshow/48640701.cms
109,Five doctors killed in a Road accident in Nashik,"Five doctors were killed and another one was injured when a car in which they were travelling collided with an unidentified vehicle at Kokangaon roundabout, police said today.",https://timesofindia.indiatimes.com/city/nashik/five-doctors-killed-in-a-road-accident-in-nashik/articleshow/47329870.cms
110,Kin get Rs 44.74 lakh for man's death in Road accident,"Thane, Aug 3 () An automobile dealer and his insurer have been asked by Thane Motor Accident Claims Tribunal to pay Rs 44.74 lakh to a woman and her two children for the death of her husband in a Road accident in 2013.",https://timesofindia.indiatimes.com/city/thane/kin-get-rs-44-74-lakh-for-mans-death-in-road-accident/articleshow/53525736.cms
111,"Road accidents claim man, woman’s lives","Two persons, including a 50-year-old woman, were killed in separate accidents in the city between Friday and Saturday.",https://timesofindia.indiatimes.com/city/pune/road-accidents-claim-man-womans-lives/articleshow/47062968.cms
112,"Pedestrian deaths in Road accidents highest in state, speeding to blame",Maharashtra continues to rank high in the country in the number of fatalities caused due to Road accidents.,https://timesofindia.indiatimes.com/city/pune/pedestrian-deaths-in-road-accidents-highest-in-state-speeding-to-blame/articleshow/48245418.cms
113,"Boulders smash cars on Mumbai-Pune Expressway, 2 killed, 4 injured","Two persons were killed and four injured in a major landslide near Adoshi tunnel on the Mumbai-Pune Expressway, 41km from Kalamboli, at 11.45am on Sunday.",https://timesofindia.indiatimes.com/city/navi-mumbai/boulders-smash-cars-on-mumbai-pune-expressway-2-killed-4-injured/articleshow/48138287.cms
114,"Two kids killed, three others injured in Mumbai",In a fatal accident two kids died and a third one was seriously injured along with his father when a dumber accidentally hit their bike on the Mankhurd-Deonar highway at eastern suburbs on late Thursday evening.,https://timesofindia.indiatimes.com/city/mumbai/two-kids-killed-three-others-injured-in-mumbai/articleshow/48104966.cms
115,Four killed in separate Road accidents in Akola,Four persons were killed in separate Road accidents in Akola district on Sunday.,https://timesofindia.indiatimes.com/city/nagpur/four-killed-in-separate-road-accidents-in-akola/articleshow/42562079.cms
116,More two-wheeler riders dying in Road accidents every year,,https://timesofindia.indiatimes.com/city/nagpur/more-two-wheeler-riders-dying-in-road-accidents-every-year/articleshow/50952943.cms
117,"Two injured in Road accident, driver arested",The Marine Drive police arrested a Swift driver for knocking down two persons in a high speed at the Marine Drive stretch on Saturday evening.,https://timesofindia.indiatimes.com/city/mumbai/two-injured-in-road-accident-driver-arested/articleshow/40346659.cms
118,Audi crash: Accident victim's family wants lawyer's degree to be confiscated,"The angry family of taxi driver Sayyed Hussain (57), killed in a Road accident by a drunken female vice president of a corporate firm, demanded that the accused Janhavi Gadkar's Law degree should be annulled and no firm should hire her for ""murdering"" two persons.",https://timesofindia.indiatimes.com/city/mumbai/audi-crash-accident-victims-family-wants-lawyers-degree-to-be-confiscated/articleshow/47648023.cms
119,Three of family die in Road accident,"Three of aq family were killed and another three injured in a collision between a truck and an MUV on Wani-Dindori road, around 40 km from Nashik city, on Thursday.",https://timesofindia.indiatimes.com/city/nashik/three-of-family-die-in-road-accident/articleshow/28300263.cms
120,"Drunk woman lawyer rams Audi into cab on Eastern Freeway, kills 2",An Audi driven at speed on the wrong side by a drunk woman hit a taxi headlong on the Eastern Freeway in the early hours of Tuesday.,https://timesofindia.indiatimes.com/city/mumbai/drunk-woman-lawyer-rams-audi-into-cab-on-eastern-freeway-kills-2/articleshow/47607933.cms
121,Tribunal grants 13 lakh to accident victim’s kin,A motor accident claims tribunal (MACT) here has ordered the owner of a truck and its insurer to jointly pay Rs 13.05 lakh compensation to the kin of a 37-year-old transporter from Shikrapur who was killed in an accident between a truck and a pick-up van at Suratgaon near Tuljapur in August 2013,https://timesofindia.indiatimes.com/city/pune/tribunal-grants-13-lakh-to-accident-victims-kin/articleshow/47321494.cms
122,Five injured in Road accident,Five students between the age group of nine to thirteen years were injured in a Road accident while on their way to school in a Maruti Omni van.,https://timesofindia.indiatimes.com/city/nashik/five-injured-in-road-accident/articleshow/19269593.cms
123,25-year-old killed in Road accident in Pimpri,A 25-year-old man died after a motorcycle dashed against his two-wheeler near the grade separator in Pimpri Tuesday midnight,https://timesofindia.indiatimes.com/city/pune/25-year-old-killed-in-road-accident-in-pimpri/articleshow/46047647.cms
124,‘Remove Arenja circle to avert Road accidents’,"The state urban development department (UDD) has directed Navi Mumbai Municipal Corporation (NMMC) to consider removing Arenja Circle junction in Vashi, as it is a potential traffic hazard.",https://timesofindia.indiatimes.com/city/navi-mumbai/remove-arenja-circle-to-avert-road-accidents/articleshow/37587794.cms
125,Negligence claims three lives in separate Road accidents,"A 51-year-old woman, who sustained severe injuries after falling off her husband's motorcycle on a bridge in Warje around noon on October 25, succumbed during treatment on Monday.",https://timesofindia.indiatimes.com/city/pune/negligence-claims-three-lives-in-separate-road-accidents/articleshow/44965091.cms
126,"Uran to get trauma centre soon, as 859 die in mishaps in 10 years",Over 800 accidents in the past decade has prompted authorities to come up with a trauma care centre in Uran taluka,https://timesofindia.indiatimes.com/city/navi-mumbai/uran-to-get-trauma-centre-soon-as-859-die-in-mishaps-in-10-years/articleshow/46124716.cms
127,"400 die each year in Road accidents in city, Pimpri Chinchwad","Around 400 lives are lost each year in Road accidents in Pune and Pimpri Chinchwad, with two-wheeler riders making up for half the deaths followed by pedestrians.",https://timesofindia.indiatimes.com/city/pune/400-die-each-year-in-road-accidents-in-city-pimpri-chinchwad/articleshow/45880277.cms
128,"Road accidents claim 54 in Jan, Feb","As per statistics provided by city traffic police, on an average Road accidents claim one life every day in the city.Fifty four people were killed on city roads in the first two months alone this year.",https://timesofindia.indiatimes.com/city/nagpur/road-accidents-claim-54-in-jan-feb/articleshow/31624318.cms
129,60-year-old dies in Road accident,"A 60-year-old man from Kalwa, who was riding pillion, was killed after a speeding dumper rammed into his bike. The incident took place on Saturday.",https://timesofindia.indiatimes.com/city/thane/60-year-old-dies-in-road-accident/articleshow/30906528.cms
130,Cop dies in Road accident,"A police constable, attached to rural police, died on the spot after his car was hit by a truck near Dahegaon, on Nagpur-Saoner Road, on Thursday.",https://timesofindia.indiatimes.com/city/nagpur/cop-dies-in-road-accident/articleshow/16691162.cms
131,72% of Road accidents in Maharashtra involve youths,"Nearly 72% of those involved in Road accidents in the state are in the age group of 20-40 years and 85% of the injured are maimed for life, highway police said.",https://timesofindia.indiatimes.com/city/mumbai/72-of-road-accidents-in-maharashtra-involve-youths/articleshow/28356621.cms
132,"Mumbai's east zone has most traffic violations, least in SoBo","South Mumbai recorded the lowest traffic violations compared to the rest of the city in the first nine months of this year, an RTI query has revealed.",https://timesofindia.indiatimes.com/city/mumbai/mumbais-east-zone-has-most-traffic-violations-least-in-sobo/articleshow/45152994.cms
133,"6 killed, 30 injured in Road accident in Maharashtra","Six persons were killed while 30 others injured in a Road accident near Yelwadi village on Beed-Ahmadnagar road here this morning, police said.",https://timesofindia.indiatimes.com/city/mumbai/6-killed-30-injured-in-road-accident-in-maharashtra/articleshow/20137873.cms
134,Three cops injured in Road accident,Three cops were injured in an accident in the Gangapur Road area while patrolling the region in their vehicle in the wee hours of Sunday.,https://timesofindia.indiatimes.com/city/nashik/three-cops-injured-in-road-accident/articleshow/19775397.cms
135,Rural Nashik sees decline in Road accident fatalities,"There has been a significant drop in the number of fatal accidents in rural parts of the district this year, as compared to the corresponding period from January 1 to June 30, 2013, Nashik rural police said.",https://timesofindia.indiatimes.com/city/nashik/rural-nashik-sees-decline-in-road-accident-fatalities/articleshow/38335249.cms
136,Pedder Road accident: DNA samples collected,The Gamdevi police probing Sunday's Pedder Road accident collected two sets of fingerprints from the Aston Martin that was involved in the mishap and said they have not made any arrests yet as facts are still being verified.,https://timesofindia.indiatimes.com/city/mumbai/pedder-road-accident-dna-samples-collected/articleshow/27230220.cms
137,Kin of man who died in Road accident to get around Rs 35 lakh,"Thane (Maha), Apr 9 () A Lok Adalat panel here today ordered a Karnataka-based transporter and an insurance company to collectively pay Rs 34.75 lakh to the family of a businessman who lost his life in a Road accident around two years back.",https://timesofindia.indiatimes.com/city/thane/kin-of-man-who-died-in-road-accident-to-get-around-rs-35-lakh/articleshow/51758285.cms
138,Three killed in separate accidents,"Three persons, including a 19-year-old college student, were killed in separate accidents across the city between Friday and Saturday.",https://timesofindia.indiatimes.com/city/pune/three-killed-in-separate-accidents/articleshow/44796738.cms
139,"95-year-old woman, two others killed in Road accidents","Three persons, including a 95-year-old woman, were killed in separate accidents in the city between Wednesday and Saturday.",https://timesofindia.indiatimes.com/city/pune/95-year-old-woman-two-others-killed-in-road-accidents/articleshow/47579442.cms
140,Cops get training to handle Road accident victims,"In a move to provide immediate treatment to accident victims, a first aid and cardiopulmonary resuscitation (CPR) training was organized for Thane police officials on Wednesday.",https://timesofindia.indiatimes.com/city/thane/cops-get-training-to-handle-road-accident-victims/articleshow/36164212.cms
141,'Parents not staying with victim entitled to damages',The Motor Accident Claims Tribunal (MACT) here has ruled that the elderly parents who are not staying with the victim of a Road accident are entitled to apt compensation that is available to the dependents.,https://timesofindia.indiatimes.com/city/pune/parents-not-staying-with-victim-entitled-to-damages/articleshow/42653598.cms
142,"5 killed, 20 injured in Road accident in Nashik","Five persons, including two children, were killed and 20 injured when a state transport bus and a gas tanker collided with a milk tanker at Rahud ghat near here, police said on Sunday.",https://timesofindia.indiatimes.com/city/nashik/5-killed-20-injured-in-road-accident-in-nashik/articleshow/34630678.cms
143,Freelance photographer dies in Road accident,"A 25-year-old freelance photographer, who was riding pillion on speedy bike at the JJ flyover, died after the rider lost control and fell on the road.",https://timesofindia.indiatimes.com/city/mumbai/freelance-photographer-dies-in-road-accident/articleshow/18089860.cms
144,NMMC floats tenders seeking consultants for mobile hospitals,The civic health department is reviving its project of providing round-the-clock emergency medical aid for Road accident victims through mobile hospitals,https://timesofindia.indiatimes.com/city/navi-mumbai/nmmc-floats-tenders-seeking-consultants-for-mobile-hospitals/articleshow/39701792.cms
145,Three injured as auto overturns in Road accident,Three people were seriously injured when an over-speeding four-wheeler hit a six-seater autorickshaw near Uppalwadi railway overbridge on Sunday afternoon.,https://timesofindia.indiatimes.com/city/nagpur/three-injured-as-auto-overturns-in-road-accident/articleshow/22450475.cms
146,Five members of Oman family perish in Road accident,Five members of a family of Indian origin perished in a Road accident at Oman recently. Their bodies were airlifted to Mumbai on Saturday and handed over to a relative.,https://timesofindia.indiatimes.com/city/mumbai/five-members-of-oman-family-perish-in-road-accident/articleshow/33710729.cms
147,5-yr-old gets Rs 1.58L claim for injuries in Road accident,"Thane, Jun 9 () A five-year-old girl has been awarded Rs 1.58 lakh compensation by the Thane Motor Accident Claims Tribunal for her injuries in a freak accident in 2013.",https://timesofindia.indiatimes.com/city/thane/5-yr-old-gets-rs-1-58l-claim-for-injuries-in-road-accident/articleshow/52667260.cms
148,"Two drown, two die in Road accident",Two youths from Nagpur who had come on a jolly trip to the famous Hajara falls in Salekasa tehsil drowned on Thursday.,https://timesofindia.indiatimes.com/city/nagpur/two-drown-two-die-in-road-accident/articleshow/22198487.cms
149,Father-son duo dies in Road accident,"Eid festivities turned into tragedy for Sheikh family of Kalmeshwar when Yusuf Sheikh Hussain Sheikh, 65, and his son Riyaz, 26, lost their lives in a hit-and-run accident on Kamptee Road on Friday.",https://timesofindia.indiatimes.com/city/nagpur/father-son-duo-dies-in-road-accident/articleshow/21737282.cms
150,Pillion rider dies after BEST bus hits bike,"A contractor, Mahendra Mandal (52), lost his life after the motorcycle on which he was riding pillion was hit by a BEST bus in Jogeshwari (East)",https://timesofindia.indiatimes.com/city/mumbai/pillion-rider-dies-after-best-bus-hits-bike/articleshow/17407777.cms
151,Pedestrian fatalities rank high in Q1 stats in Navi Mumbai,Motorcyclists Top Death List In 3 Months in NAvi Mumbai,https://timesofindia.indiatimes.com/city/navi-mumbai/pedestrian-fatalities-rank-high-in-q1-stats-in-navi-mumbai/articleshow/36450006.cms
152,"2 Road accidents in Navi Mumbai's Palm Beach Road, 4 dead","In two separate accidents along the Palm Beach Road, four persons were killed at Vashi and Sanpada.",https://timesofindia.indiatimes.com/city/navi-mumbai/2-road-accidents-in-navi-mumbais-palm-beach-road-4-dead/articleshow/48198966.cms
153,"7, including cop, 2 kids killed in Road accident","Seven people among ten travelling in a car were killed in a horrific smash-up on Chhindwara Road, near Kelvad police station, on Saturday night.",https://timesofindia.indiatimes.com/city/nagpur/7-including-cop-2-kids-killed-in-road-accident/articleshow/40829379.cms
154,24-year-old killed in Road accident,A 24-year-old woman was killed after the scooter she was riding was knocked down by a truck accompanying one of the 'dindis' in the Sant Tukaram palkhi on Mumbai-Pune highway in Dehu Road.,https://timesofindia.indiatimes.com/city/pune/24-year-old-killed-in-road-accident/articleshow/20851931.cms
155,Two killed in Road accidents in Nashik,Two die in separate Road accidents two people were reported dead in separate Road accidents on Tuesday.,https://timesofindia.indiatimes.com/city/nashik/two-killed-in-road-accidents-in-nashik/articleshow/16857004.cms
156,Over 40% insurance claims for motor accidents in Mumbai region pending in the last decade,Insuring your vehicle against mishaps is undoubtedly essential.,https://timesofindia.indiatimes.com/city/mumbai/over-40-insurance-claims-for-motor-accidents-in-mumbai-region-pending-in-the-last-decade/articleshow/16872777.cms
157,Couple killed in e-way accident near Lonavla,"A couple from Vishrantwadi died after their car hit a retaining wall and fell into a trench along the Pune-Mumbai expressway in Malavli, near Lonavla, on Thursday evening.",https://timesofindia.indiatimes.com/city/pune/couple-killed-in-e-way-accident-near-lonavla/articleshow/35175888.cms
158,"Woman dies, minor son has miraculous escape in Road accident at Vasai",A woman was killed and four others were injured when the taxi in which they were travelling lost control and fell 20 feet into a nullah on the Mumbai-Ahmedabad national highway at Vasai on Sunday.,https://timesofindia.indiatimes.com/city/mumbai/woman-dies-minor-son-has-miraculous-escape-in-road-accident-at-vasai/articleshow/47949531.cms
159,"Girl dies on road, parents killed after collecting body",Three members of a family were killed along with a relative in two separate Road accidents on Thursday in a span of four hours in Ratnagiri district.,https://timesofindia.indiatimes.com/city/mumbai/girl-dies-on-road-parents-killed-after-collecting-body/articleshow/34843631.cms
160,Mumbaikars reluctant to help Road accident victims: Survey,"Ninety-three percent of people are reluctant to help an accident victim due to the fear of 'legal hassles', found a survey conducted across Mumbai, Delhi, Bangalore, Kolkata and Ahmedabad.",https://timesofindia.indiatimes.com/city/mumbai/mumbaikars-reluctant-to-help-road-accident-victims-survey/articleshow/28608196.cms
161,"Mumbai cops kill man, show death as Road accident",Investigations into the death of a youth passed off as accidental by Sewri police five years ago have again revealed the sinister side of Mumbai cops.,https://timesofindia.indiatimes.com/city/mumbai/mumbai-cops-kill-man-show-death-as-road-accident/articleshow/38500144.cms
162,Police constable going for election duty dies in Road accident near Mumbai,A police constable travelling for the Vasai Virar Municipal Corporation (VVMC) election duty was killed when his tempo hit a state transport bus on Sunday morning.,https://timesofindia.indiatimes.com/city/mumbai/police-constable-going-for-election-duty-dies-in-road-accident-near-mumbai/articleshow/47665748.cms
163,Pedder Road accident: Cops get CCTV grabs,"To enhance the quality of the CCTV images with the help of advanced softwares, they will be sent to Kalina’s forensic science laboratory.",https://timesofindia.indiatimes.com/city/mumbai/pedder-road-accident-cops-get-cctv-grabs/articleshow/27202756.cms
164,Eight from Madhya Pradesh die in Road accident,Eight people were killed and two seriously injured in a collision between a truck and a sports utility vehicle (SUV) on the Manmad-Malegaon Road on Saturday.,https://timesofindia.indiatimes.com/city/nashik/eight-from-madhya-pradesh-die-in-road-accident/articleshow/27042549.cms
