sno,h,sub_h,link
79,Maximum accidents reported near Khopoli on old Mumbai-Pune highway,"Traffic moving towards Mumbai from Pune on the old Mumbai-Pune Highway (NH-48) saw a higher number of fatal Road accidents near two points — Panvel city and Khopoli — in 2020, revealed a study by the NGO SaveLIFE Foundation, in collaboration with the Maharashtra State Road Development Corporation (MSRDC) and the Maharashtra highway police.",https://timesofindia.indiatimes.com/city/pune/maximum-accidents-reported-near-khopoli-on-old-mum-pune-highway/articleshow/87265074.cms
80,NHAI officials inspect accidents spots on Malegaon highway,,https://timesofindia.indiatimes.com/city/nashik/nhai-officials-inspect-accidents-spots-on-malegaon-highway/articleshow/80936035.cms
81,Maharashtra govt renames college hostels as ‘Matoshree’,Uddhav Thackeray-led Maharashtra government will rename college hostels coming under the preview of higher & technical education department as ‘Matoshree’ government hostels.,https://timesofindia.indiatimes.com/city/mumbai/state-govt-renames-college-hostels-as-matoshree-in-mumbai/articleshow/81540408.cms
82,8 migrant workers killed in road mishaps in Maharashtra during lockdown,,https://timesofindia.indiatimes.com/city/mumbai/8-workers-died-in-road-mishaps-in-maharashtra/articleshow/75640292.cms
83,Traffic Safety Week starts from today,,https://timesofindia.indiatimes.com/city/nashik/traffic-safety-week-starts-from-today/articleshow/73196003.cms
84,"Maharashtra: Road crashes high even with curbs, laments CM Uddhav Thackeray","CM Uddhav Thackeray on Tuesday said that despite Covid-19 travel restrictions, road crashes in the state did not come down drastically in 2020 and fatalities were almost as high as in 2019.",https://timesofindia.indiatimes.com/city/mumbai/mumbai-road-crashes-high-even-with-curbs-laments-cm/articleshow/85817603.cms
85,Nagpur: Pench tiger ‘Mystery Male’ injured in hit-and-run on NH7,"The tiger is suspected to have been hit by a speeding vehicle either in the night or during the wee hours while crossing the NH7. The incident came to light around 10.15am when a family, which was on its way to Nagpur from Narsinghpur to treat its son, had stopped close to the guide wall near Paoni to attend nature’s call.",https://timesofindia.indiatimes.com/city/nagpur/pench-tiger-injured-in-hit-and-run-on-nh7/articleshow/89124614.cms
86,Nashik cops to crack whip on wrong-side driving,The resumption of routine activities has brought back the problem of wrong-side driving on the city roads. The city traffic branch has decided to take up a special drive against such erring motorists.,https://timesofindia.indiatimes.com/city/nashik/nashik-cops-to-crack-whip-on-wrong-side-driving/articleshow/80726540.cms
87,City sees a drop in death count during lockdown,,https://timesofindia.indiatimes.com/city/nagpur/city-sees-a-drop-in-death-count-during-lockdown/articleshow/75480880.cms
88,Navi Mumbai: Tantrik arrested for cheating Kharghar resident of Rs 4.57 lakh,"The victim, a resident of Kharghar, had contacted the accused Baba Karim Khan Bengali, who was later identified as Wasim Khan alias Baba Kabir Khan Bangali",https://timesofindia.indiatimes.com/city/navi-mumbai/navi-mumbai-tantrik-arrested-for-cheating-kharghar-resident-of-rs-4-57-lakh-by-promising-to-help-her-win-back-estranged-lover/articleshow/84347150.cms
89,Nashik constable succumbs to Covid-19,,https://timesofindia.indiatimes.com/city/nashik/nashik-constable-succumbs-to-covid-19/articleshow/78112400.cms
90,Nagpur: Motor Vehicle Act amended to curb accidents said Gadkari,"Union transport minister Nitin Gadkari on Saturday defended the Motor Vehicles (Amendment) Act, 2019, that has enforced hefty penalties for traffic offences. He said the fines have been increased manifold not to generate revenue but to save lives in s.",https://timesofindia.indiatimes.com/city/nagpur/mv-act-amended-to-curb-accidents-not-to-generate-revenue-gadkari/articleshow/73206014.cms
91,Mumbai: ‘No Covid infection due to organ transplants during the pandemic’,,https://timesofindia.indiatimes.com/city/mumbai/mumbai-no-covid-infection-due-to-organ-transplants-during-the-pandemic/articleshow/84775162.cms
92,Thane: Former corporator demands KDMC to fill potholes on Dwarli road in Kalyan,"A former corporator, Kunal Patil, has demanded Kalyan-Dombivli Municipal Corporation (KDMC) to fill potholes using good quality materials on Dwarli village road stretch situated on Kalyan-Malang road or else he will start an agitation.",https://timesofindia.indiatimes.com/city/thane/thane-former-corporator-demands-kdmc-to-fill-potholes-on-dwarli-road-in-kalyan/articleshow/77673204.cms
93,No progress on animal transit treatment centres,,https://timesofindia.indiatimes.com/city/nashik/no-progress-on-animal-transit-treatment-centres/articleshow/82234269.cms
94,Free helmets for school kids’ parents,,https://timesofindia.indiatimes.com/city/nagpur/free-helmets-for-school-kids-parents/articleshow/74323797.cms
95,Guard booked for wife’s murder in Pune,A 25-year-old watchman at a Phursungi residential society was booked on the charge of murdering his wife (22) and misleading the police that she died in an accident when their motorcycle skidded off the road at high speed.,https://timesofindia.indiatimes.com/city/pune/guard-booked-for-wifes-murder/articleshow/80488721.cms
96,70-year-old woman found brutally murdered at home in Pune,"The Sinhagad Road police have launched an investigation after a Hingne Khurd resident, Shalini Baban Sonawane (70), was found murdered in the living room of her one-bedroom flat around 10pm on Saturday.",https://timesofindia.indiatimes.com/city/pune/70-year-old-woman-found-brutally-murdered-at-home/articleshow/87440477.cms
97,Eunuch dies in accident near Sangamner,,https://timesofindia.indiatimes.com/city/nashik/eunuch-dies-in-accident-near-sangamner/articleshow/79106090.cms
98,"Nagpur: Pay Rs 500 more for jumping signal, riding without helmet","Beware! traffic violators, especially those jumping red signals, using mobile phones while driving/riding, riding without helmet and not wearing seat belts while driving four-wheelers. The Nagpur traffic police have started imposing section 179 of Motor Vehicle Act, whereby violators will now be fined Rs500 more for each of these offences.",https://timesofindia.indiatimes.com/city/nagpur/pay-rs500-more-for-jumping-signal-riding-without-helmet/articleshow/86493389.cms
99,"Zip, Zap, Zoom: Wardha Road tops the speed violation chart","A speed survey of the city’s eight roads by Parisar, a Pune-based NGO and Road Safety Network, has revealed that the Central Jail road or Wardha Road has a very high percentage of speed violations or driving at breakneck speed.",https://timesofindia.indiatimes.com/city/nagpur/zip-zap-zoom-wardha-road-tops-the-speed-violation-chart/articleshow/83652326.cms
100,"Come Oct, 6 airbags must in all cars up to 8 seaters",,https://timesofindia.indiatimes.com/city/nagpur/come-oct-6-airbags-must-in-all-cars-up-to-8-seaters/articleshow/88905994.cms
101,"Heroes bring injured camel from 200km, doctors amputate leg","Even amidst the Covid-19 pandemic, there are people bringing sunshine, trying to save lives of animals too. In the city, a group of experts have come together to save the life of a four-year-old camel from Rajasthan, which was found injured at a farm near Amravati.",https://timesofindia.indiatimes.com/city/nagpur/heroes-bring-injured-camel-from-200km-doctors-amputate-leg/articleshow/82335292.cms
102,Pune: Traffic police step up action against drunk driving,"The Koregaon Park traffic division has so far registered the highest drunk driving cases across the city, prompting it to set up nakabandi at multiple locations. Women police personnel have also been deployed to ensure that all drunk drivers are brought to book.",https://timesofindia.indiatimes.com/city/pune/traffic-police-step-up-action-against-drunk-driving/articleshow/72986392.cms
103,Covid wary public speeds up sale of private vehicles,,https://timesofindia.indiatimes.com/city/nagpur/covid-wary-public-speeds-up-sale-of-private-vehicles/articleshow/86240832.cms
104,‘Research & tech by institutes in backward areas can play key role’,,https://timesofindia.indiatimes.com/city/nagpur/research-tech-by-institutes-in-backward-areas-can-play-key-role/articleshow/86240617.cms
105,NGOs bat for road safety measures,,https://timesofindia.indiatimes.com/city/pune/ngos-bat-for-road-safety-measures/articleshow/75782767.cms
106,5 accidents in 6 hrs at Katraj; 2 dead,"8 were left injured in the series of separate mishaps near Katraj tunnel on Mumbai-Bengaluru national highway; NHAI, cops probe issue",https://timesofindia.indiatimes.com/city/pune/5-accidents-in-6-hrs-at-katraj-2-dead/articleshow/80235611.cms
107,81 of 98 bikers who died in 2019 were riding helmetless,,https://timesofindia.indiatimes.com/city/nashik/81-of-98-bikers-who-died-in-2019-were-riding-helmetless/articleshow/73218747.cms
108,Pune: Walkathon for accident victims,A coalition of road safety NGOs — Road Safety Network and its member Parisar — will organize a walkathon in the city on Sunday to commemorate Road accident victims on the occasion of World Day of Remembrance.,https://timesofindia.indiatimes.com/city/pune/walkathon-for-accident-victims/articleshow/72030110.cms
109,"Rs 99,600 fine recovered from erring motorists","The traffic police slapped fines on 312 motorists for violating traffic rules in a single day on Wednesday and recovered close to Rs 99,600.",https://timesofindia.indiatimes.com/city/nashik/99600-fine-recovered-from-erring-motorists/articleshow/77794185.cms
110,"One killed, five injured in mishap on Mumbai-Pune expressway","Navi Mumbai (Maharashtra) [India], May 17 (ANI) One person was killed and five sustained serious injuries in an accident on Mumbai-Pune Expressway in Kalamboli area of Navi Mumbai.",https://timesofindia.indiatimes.com/city/navi-mumbai/one-killed-five-injured-in-mishap-on-mumbai-pune-expressway/articleshow/75787491.cms
111,"36-year-old cop dies of Covid-19, Maharashtra toll 112","A 36-year-old constable from Beed died due to Covid on August 3, taking the state police force toll to 112. In the last 24 hours, 254 fresh cases were reported from state police, taking the tally to 10,427.",https://timesofindia.indiatimes.com/city/mumbai/36-year-old-cop-dies-of-covid-19-maharashtra-toll-112/articleshow/77429405.cms
112,"Pune: Accidents & fatalities down since last year, activists seek stricter laws","Traffic police records have revealed a drop in Road accidents and deaths in the city in the first 10 months of 2019 as against the same period last year, but activists feel a lot more has to be done to check violations of rules.",https://timesofindia.indiatimes.com/city/pune/accidents-fatalities-down-since-last-year-activists-seek-stricter-laws/articleshow/71913015.cms
113,Mumbai: Police inspector succumbs to Covid-19; 75th death in city force,"A 53-year-old inspector attached to Vakola police station succumbed to Covid-19 early on Sunday. Inspector Xavier Rego, who had recently been hospitalised after a Road accident, was on leave and was recovering. His Covid test report came positive later on Sunday after his death.",https://timesofindia.indiatimes.com/city/mumbai/mumbai-police-inspector-succumbs-to-covid-19-75th-death-in-city-force/articleshow/78092996.cms
114,Watch out! City has 24 accident-prone spots,,https://timesofindia.indiatimes.com/city/nagpur/watch-out-city-has-24-accident-prone-spots/articleshow/73393643.cms
115,"Traffic rule ‘violated’, this time by Maharashtra government by not implementing amended Motor Vehicle Act","Madhya Pradesh, Chhattisgarh, Rajasthan, Kerala, Odisha and West Bengal have put the amended Motor Vehicles Act 2019 on hold. BJP-ruled Gujarat had slashed fines by as much as 90%.",https://timesofindia.indiatimes.com/city/nagpur/traffic-rule-violated-this-time-by-state-govt-by-not-implementing-amended-mv-act/articleshow/71413879.cms
116,"Internal roads more prone to accidents, reveal records","Highways passing through the city are dangerous, but the city’s interior roads are more accident-prone. Going by the figures available with the city police, more people die on the interior roads than on the state and national highways.",https://timesofindia.indiatimes.com/city/nashik/internal-roads-more-prone-to-accidents-reveal-records/articleshow/74273242.cms
117,Cases of over-speeding rise on highway near Kasara Ghoti,,https://timesofindia.indiatimes.com/city/nashik/cases-of-over-speeding-rise-on-highway-near-kasara-ghoti/articleshow/80218988.cms
118,"Now, Maharashtra govt wants kids to learn all about traffic rules","Hoping to raise responsible citizens, education department has decided to incorporate traffic rules in learning for children. Primary school teachers have been told to include traffic regulations and safety in subjects to create awareness.",https://timesofindia.indiatimes.com/city/mumbai/kids-to-learn-all-about-traffic-rules/articleshow/78688809.cms
119,"Thane: Rs 13 lakh+ relief to kin of farmer, son killed in road mishap","A Motor Accident Claims Tribunal (MACT) in Thane, in separate orders, awarded a co-llective compensation of Rs 13.5 lakh to the kin of a farmer and his 14-year-old son who died in a Road accident in 2018.",https://timesofindia.indiatimes.com/city/mumbai/thane-rs-13-lakh-relief-to-kin-of-farmer-son-killed-in-road-mishap/articleshow/79505922.cms
120,"Man murders relative, stages accident to mislead police",,https://timesofindia.indiatimes.com/city/pune/man-murders-relative-stages-accident-to-mislead-police/articleshow/81608660.cms
121,Nagpur: Aapli bus passengers irked due to curtailed timings,"With the ‘Break The Chain’ restrictions allowing establishments in the city to remain open only till 4pm, the Nagpur Municipal Corporation (NMC) has curtailed the Aapli Bus timings. From earlier 6am to 10pm, the city bus service is operating only till 7pm.",https://timesofindia.indiatimes.com/city/nagpur/aapli-bus-passengers-irked-due-to-curtailed-timings/articleshow/84245997.cms
122,Yavatmal doc restores shoulder of poor farmer,,https://timesofindia.indiatimes.com/city/nagpur/yavatmal-doc-restores-shoulder-of-poor-farmer/articleshow/79416767.cms
123,"Covid-19 claims 35 cops from Maharashtra in 13 days, toll now 192","September could turn out to be the worst-hit month for the state police force, with 35 personnel having succumbed to Covid-19 in the first 13 days of the month. In August, a total of 54 personnel had died due to the virus. In the last 48 hours, four police personnel died due to the virus—two from Mumbai, one each from Thane and Amravati.",https://timesofindia.indiatimes.com/city/mumbai/covid-19-claims-35-cops-from-maharashtra-in-13-days-toll-now-192/articleshow/78097030.cms
124,2 killed in hit-and-run on highways,,https://timesofindia.indiatimes.com/city/nashik/2-killed-in-hit-and-run-on-highways/articleshow/78082794.cms
125,NMC has no money to concretize 28 tar roads,,https://timesofindia.indiatimes.com/city/nagpur/nmc-has-no-money-to-concretize-28-tar-roads/articleshow/85018976.cms
126,"Sisters, 60 and 50, found dead in Juni Kamptee",,https://timesofindia.indiatimes.com/city/nagpur/sisters-60-and-50-found-dead-in-juni-kamptee/articleshow/80141002.cms
127,Stand on making roads pothole-free reinforced,,https://timesofindia.indiatimes.com/city/nagpur/stand-on-making-roads-pothole-free-reinforced/articleshow/72960653.cms
128,"Tapan Patel, industrialist & politician, dies in accident","Tapan Patel (41), an industrialist and chairperson of the public works department (PWD) of Shirpur municipality of Dhule district, died in a Road accident near Shirpur, 200 km from Nashik city, around 12.30am on Wednesday. He is survived by his mother, wife and two children, said the police.",https://timesofindia.indiatimes.com/city/nashik/tapan-patel-industrialist-politician-dies-in-accident/articleshow/78415481.cms
129,"Nashik: Man beats wife to death, tries to pass it off as accident","A 65-year-old man allegedly beat his wife to death and later tried to pass it off as a Road accident in Maharashtra's Nashik district, police said on Tuesday.",https://timesofindia.indiatimes.com/city/nashik/nashik-man-beats-wife-to-death-tries-to-pass-it-off-as-accident/articleshow/71276917.cms
130,"Pune: Two steal cash, phone from man injured in accident","A 54-year-old man on Thursday lodged an FIR with the Hadapsar police, alleging that two men stole Rs27,000 and a cellphone worth Rs3,000 from him after he met with a Road accident on August 31.",https://timesofindia.indiatimes.com/city/pune/2-steal-cash-phone-from-man-injured-in-accident/articleshow/78067244.cms
131,Showrooms to face music if they fail to sell helmets: Kolhapur RTO,The regional transport office of Kolhapur has decided to crack the whip on showrooms in the district that fail to provide helmets at the time of sale of two-wheelers to the owners.,https://timesofindia.indiatimes.com/city/kolhapur/showrooms-to-face-music-if-they-fail-to-sell-helmets-kolhapur-rto/articleshow/74572211.cms
132,Optimizing locations of EMVs can cut travel time: Study,,https://timesofindia.indiatimes.com/city/nagpur/optimizing-locations-of-emvs-can-cut-travel-time-study/articleshow/77208273.cms
133,Mumbai cyclists take to the streets on World Car-Free Day,"The ride was organised by the city's bicycle mayor, councillors and marshals, to inspire more people to take to cycling.",https://timesofindia.indiatimes.com/city/mumbai/mumbai-cyclists-take-to-the-streets-on-world-car-free-day/articleshow/86457533.cms
134,"Maharashtra: Man escapes Covid-19 facility, found dead on road","Hours after he escaped from a Covid-19 centre in Amalner in Maharashtra's Jalgaon district on August 10, a 32-year-old man was found dead on road, police said on Tuesday.",https://timesofindia.indiatimes.com/city/pune/maharashtra-man-escapes-covid-19-facility-found-dead-on-road/articleshow/77483057.cms
135,Darkness reigns on many stretches of Pune's Baner Road as street lights go kaput,"Street lights on several stretches of Baner Road are on the blink, posing a danger bikers and cyclists, especially on dark, rainy nights. The problem has spread to several upmarket locales in the Baner area, verified by a TOI visit on Saturday — hundreds of street lights are either missing entirely or lack light bulbs.",https://timesofindia.indiatimes.com/city/pune/darkness-reigns-on-many-stretches-of-baner-road-as-street-lights-go-kaput/articleshow/85336522.cms
136,Focus on fining 2-wheeler riders: Commissioner of police to traffic cops,,https://timesofindia.indiatimes.com/city/nagpur/focus-on-fining-2-wheeler-riders-cp-to-traffic-cops/articleshow/67841402.cms
137,"Joint efforts to make roads free of accidents, fatalities","The Nashik district administration and the city police have decided to go all out in 2019 to make the city roads safer. The city been witnessing a steady rise in Road accidents and fatalities due to various reasons, rash driving being one of them.",https://timesofindia.indiatimes.com/city/nashik/joint-efforts-to-make-roads-free-of-accidents-fatalities/articleshow/67328137.cms
138,"Only 1 fatal mishap in Mumbai due to bad roads, potholes in ’18: RTI",,https://timesofindia.indiatimes.com/city/mumbai/only-1-fatal-mishap-in-mumbai-due-to-bad-roads-potholes-in-18-rti/articleshow/68312583.cms
139,"Maharashtra: 2 corporators, 2 others held for attacking Nashik cops","Two corporators from the Shiv Sena and BJP as well as two others were arrested on Monday for attacking police personnel in Nashik city in Maharashtra after a Road accident, an official said.",https://timesofindia.indiatimes.com/city/nashik/maharashtra-2-corporators-2-others-held-for-attacking-nashik-cops/articleshow/76692011.cms
140,TV show talent manager dies in bike mishap in Mumbai,"A 25-year-old talent manager of Bigg Boss 14 was killed in a Road accident after she fell under the rear tyre of a vanity van as her bike skidded near Sahakari Bhandar, outside Film City, in Goregaon (E) around 12.30am on Friday.",https://timesofindia.indiatimes.com/city/mumbai/tv-show-talent-manager-dies-in-bike-mishap/articleshow/80307250.cms
141,Activists shoot letter to Nitin Gadkari,"Road Safety Network, a coalition of road safety organizations, has written to Union road transport minister Nitin Gadkari, urging him to to reintroduce the Motor Vehicles (Amendment) bill in the Parliament.",https://timesofindia.indiatimes.com/city/pune/activists-shoot-letter-to-gadkari/articleshow/69708252.cms
142,"Rs249cr allocated for roads, yet no end to potholes in city",,https://timesofindia.indiatimes.com/city/nagpur/rs249cr-allocated-for-roads-yet-no-end-to-potholes-in-city/articleshow/86240426.cms
143,Speeding behind 178 fatal accidents last yr: Report,,https://timesofindia.indiatimes.com/city/nagpur/speeding-behind-178-fatal-accidents-last-yr-report/articleshow/68086696.cms
144,Maharashtra: Split cadaver liver transplant saves life of 18-month-old Buldhana girl,"City-based surgeons performed the state's first split cadaver liver transplant during the pandemic, in December last year.",https://timesofindia.indiatimes.com/city/pune/maharashtra-split-cadaver-liver-transplant-saves-life-of-18-month-old-buldhana-girl/articleshow/83162702.cms
145,Mills to be booked for accidents by heavy vehicles,,https://timesofindia.indiatimes.com/city/kolhapur/mills-to-be-booked-for-accidents-by-heavy-vehicles/articleshow/72497443.cms
146,FIR against leader of opposition Pravin Darekar for protest outside Mumbai hospital,"An FIR has been registered against leader of opposition in the Maharashtra Legislative Council Pravin Darekar for protesting outside a hospital here over a patient's body being handed over to wrong family, police said on Thursday.",https://timesofindia.indiatimes.com/city/mumbai/fir-against-leader-of-opposition-darekar-for-protest-outside-mumbai-hospital/articleshow/78167152.cms
147,Maharashtra: 140 trees near Bapu Kuti in Sevagram to face the axe,"Despite opposition by Wardha Vriksh Bachao Nagrik Samiti (VBNS) and three generations of Mahatma Gandhi’s family, the public works department (PWD) has decided to cut 140 trees on the road near Bapu Kuti in Sevagram.",https://timesofindia.indiatimes.com/city/nagpur/140-trees-near-bapu-kuti-to-face-the-axe/articleshow/84656449.cms
148,Struggling dancer found dead inside house in Hadapsar,Visakha Kale died by suicide as she was not getting work due to lockdown,https://timesofindia.indiatimes.com/city/pune/struggling-dancer-found-dead-inside-house-in-hadapsar/articleshow/78557950.cms
149,"Mumbai: Save animals from rash drivers post-lockdown, urge activists","Animal rights activists are raising further awareness through online media about the unfortunate and avoidable deaths of local community dogs, cats, even squirrels, on the roads due to rash driving by motorists in the post-lockdown period.",https://timesofindia.indiatimes.com/city/mumbai/mumbai-save-animals-from-rash-drivers-post-lockdown-urge-activists/articleshow/77481673.cms
150,"2 leopards electrocuted, another dies in accident",,https://timesofindia.indiatimes.com/city/nagpur/2-leopards-electrocuted-another-dies-in-accident/articleshow/79946263.cms
151,150 lose lives on city roads in 424 accidents till Sept,,https://timesofindia.indiatimes.com/city/nashik/150-lose-lives-on-city-roads-in-424-accidents-till-sept/articleshow/66110658.cms
152,NHAI starts acquiring land for 4-laning of palkhi routes,,https://timesofindia.indiatimes.com/city/pune/nhai-starts-acquiring-land-for-4-laning-of-palkhi-routes/articleshow/80192002.cms
153,Nagpur: Sadar residents in ‘lockdown’ for a year due to overflowing sewage,"After a five-month Covid-induced lockdown, residents and shopkeepers in J&K Bank lane behind Karachi Galli in Sadar are suffering from another lockdown of sorts — sewage water overflowing on the street since early 2020.",https://timesofindia.indiatimes.com/city/nagpur/sadar-residents-in-lockdown-for-a-year-due-to-overflowing-sewage/articleshow/81197603.cms
154,Cops issue fresh plea for helmet as 2 bikers die,,https://timesofindia.indiatimes.com/city/nashik/cops-issue-fresh-plea-for-helmet-as-2-bikers-die/articleshow/68963374.cms
155,City records 73% rise in traffic violations,,https://timesofindia.indiatimes.com/city/nagpur/city-records-73-rise-in-traffic-violations/articleshow/84753889.cms
156,Mumbai: RTO agent dies as SUV hits a tree after birthday party,"A 30-year-old man, who had gone with friends to celebrate his cousin’s birthday at a Bhiwandi eatery, died in a Road accident, while others suffered minor injuries at Sion on Eastern Express Highway early on Saturday.",https://timesofindia.indiatimes.com/city/mumbai/rto-agent-dies-as-suv-hits-a-tree-after-birthday-party/articleshow/77567387.cms
157,Road Safety Week from Feb 4 to 10,,https://timesofindia.indiatimes.com/city/pune/road-safety-week-from-feb-4-to-10/articleshow/67401115.cms
158,"Infinity Ride 2020 wheels into Nagpur, to scout for talent in para sports","On a mission to raise awareness about para sports in India, state’s para cyclist Harshit Mundra alongside country’s only woman para cyclist Tanya Daga and other 28 riders under the banner ‘Aditya Mehta Foundation’s (AMF) Infinity Ride 2020’ arrived in the city on Saturday to scout for local talent.",https://timesofindia.indiatimes.com/city/nagpur/infinity-ride-2020-wheels-into-cityto-scout-for-talent-in-para-sports/articleshow/79700490.cms
159,Police to crack whip on drunk drivers for a week,done,https://timesofindia.indiatimes.com/city/nashik/police-to-crack-whip-on-drunk-drivers-for-a-week/articleshow/67247284.cms
