sno,h,sub_h,link
1,63-yr-old killed in Road accident,,https://timesofindia.indiatimes.com/city/nashik/63-yr-old-killed-in-road-accident/articleshow/102371047.cms
2,"Biker fakes rd accident, extorts Rs 22,000 and gold ring","A biker extorted of Rs 22,000 and a gold ring from a 46-year-old accountant with a private company claiming the car brushed against his bike on Mumbra-Panvel road.",https://timesofindia.indiatimes.com/city/thane/biker-fakes-rd-accident-extorts-22k-and-gold-ring/articleshow/102121257.cms
3,Three-vehicle collision hits GB rd traffic,"In a freak mishap, a container truck, a loaded trailer and a car collided near Gaikmukh and led to a major traffic jam on the Mumbai-bound lane of Ghodbunder Road and Ahmedabad highway on Tuesday morning, officials informed.",https://timesofindia.indiatimes.com/city/thane/three-vehicle-collision-hits-gb-rd-traffic/articleshow/102332879.cms
4,"6 dead, 5 injured in Road accident on Mumbai-Nashik highway",Six people were killed whereas five others sustained injuries after a container hit a jeep near Padgha-Khadavali turning point on Mumbai-Nashik highway on Tuesday morning.,https://timesofindia.indiatimes.com/city/thane/4-dead-5-injured-in-road-accident-on-mumbai-nashik-highway/articleshow/101849590.cms
5,Senior citizen killed in Nashik Road accident,,https://timesofindia.indiatimes.com/city/nashik/senior-citizen-killed-in-nashik-road-accident/articleshow/101559055.cms
6,3 killed in Road accidents in Nashik district,,https://timesofindia.indiatimes.com/city/nashik/3-killed-in-road-accidents-in-nashik-district/articleshow/101472219.cms
7,2 kids among three dead in Road accident,,https://timesofindia.indiatimes.com/city/nagpur/2-kids-among-three-dead-in-road-accident/articleshow/101652612.cms
8,36-year-old man dies in Road accident,,https://timesofindia.indiatimes.com/city/nagpur/36-year-old-man-dies-in-road-accident/articleshow/101606564.cms
9,2 killed in separate accidents on Trimbak Road,,https://timesofindia.indiatimes.com/city/nashik/2-killed-in-separate-accidents-on-trimbak-road/articleshow/101683196.cms
10,Nashik traffic cops fine over 4k helmetless bikers during drive,,https://timesofindia.indiatimes.com/city/nashik/nashik-traffic-cops-fine-over-4k-helmetless-bikers-during-drive/articleshow/101652988.cms
11,Police naik killed in bike accident,,https://timesofindia.indiatimes.com/city/nashik/police-naik-killed-in-bike-accident/articleshow/101623832.cms
12,Nashik-Mumbai highway stretch claimed over 950 lives in 2 years,"The Nashik-Mumbai stretch of the Mumbai-Agra highway has seen 953 deaths in 2021 and 2022. Of them, 472 fatalities were in 2021 and 481 were in 2022.",https://timesofindia.indiatimes.com/city/nashik/nashik-mum-highway-stretch-claimed-over-950-lives-in-2-yrs/articleshow/101623820.cms
13,Akola doctors reconstruct 17-yr-old’s broken jaw with multiple fractures,,https://timesofindia.indiatimes.com/city/nagpur/akola-doctors-reconstruct-17-yr-olds-broken-jaw-with-multiple-fractures/articleshow/101623574.cms
14,"Biker rams tree near Gangapur Rd at night, dies",,https://timesofindia.indiatimes.com/city/nashik/biker-rams-tree-near-gangapur-rd-at-night-dies/articleshow/101586823.cms
15,82-year-old man dies after falling from 3rd floor,,https://timesofindia.indiatimes.com/city/nagpur/82-year-old-man-dies-after-falling-from-3rd-floor/articleshow/101558748.cms
16,Pvt bus operators change lane from eway to old routes,,https://timesofindia.indiatimes.com/city/nagpur/pvt-bus-operators-change-lane-from-eway-to-old-routes/articleshow/101558733.cms
17,Many detained as Cong protests poor civic amenities,,https://timesofindia.indiatimes.com/city/nagpur/many-detained-as-cong-protests-poor-civic-amenities/articleshow/101558728.cms
18,"Girgaum Chowpatty death: Cocktail of speed, brakes and rain","Akbar Khan (42), who died in a Road accident at Girgaum Chowpatty on Wednesday morning after a speeding car driven by a minor rammed his bike, had told his wife he would be home in 10 minutes when she called at 5am. Half an hour later, when she called him again, she was told about the accident.",https://timesofindia.indiatimes.com/city/mumbai/chowpatty-death-cocktail-of-speed-brakes-and-rain/articleshow/101030163.cms
19,Potholes emerge in city after just 1 week of rain,,https://timesofindia.indiatimes.com/city/nashik/potholes-emerge-in-city-after-just-1-week-of-rain/articleshow/101443938.cms
20,No speed-reducing measures yet at 27 black spots in Nashik,,https://timesofindia.indiatimes.com/city/nashik/no-speed-reducing-measures-yet-at-27-black-spots-in-nashik/articleshow/101443916.cms
21,Four of family killed as MUV hits wall on Samruddhi Expressway,Four members of a family died when their vehicle hit a roadside wall on Samruddhi highway near Sinnar on Monday.,https://timesofindia.indiatimes.com/city/nashik/four-of-family-killed-as-muv-hits-wall-on-samruddhi-expressway/articleshow/100932875.cms
22,He has a good track record: Bus owner defends driver,,https://timesofindia.indiatimes.com/city/nagpur/he-has-a-good-track-record-bus-owner-defends-driver/articleshow/101426920.cms
23,40-year-old driver from Gujarat dies in Road accident in Thane,A 40-year-old driver from Gujarat died in a freak mishap at Ghodbunder road during the wee hours of Saturday after a container truck collided with another cargo-carrying truck from behind.,https://timesofindia.indiatimes.com/city/thane/40-year-old-driver-from-gujarat-dies-in-road-accident-in-thane/articleshow/101772479.cms
24,80 accident deaths between Jan & May in ’23 on city roads; slightly less than ’22,,https://timesofindia.indiatimes.com/city/nashik/80-accident-deaths-between-jan-may-in-23-on-city-roads-slightly-less-than-22/articleshow/101324035.cms
25,Double trouble: Stormwater work damages existing sewage network,At least four localities in south-west Nagpur are facing hardships due to two ongoing works — laying of stormwater network undertaken by Nagpur Improvement Trust (NIT) and cement road construction started by Nagpur Municipal Corporation (NMC).,https://timesofindia.indiatimes.com/city/nagpur/double-trouble-stormwater-work-damages-existing-sewage-network/articleshow/101230622.cms
26,"Now, no entry for helmetless riders at RTO offices","Beware, two-wheeler riders! The next time you visit the city, east and rural Regional Transport Offices (RTO), make sure to wear a helmet, as the RTO has made it mandatory for all two-wheeler riders and pillion riders to follow the rule, else face action.",https://timesofindia.indiatimes.com/city/nagpur/now-no-entry-for-helmetless-riders-at-rto-offices/articleshow/101176995.cms
27,Senior citizen killed in Road accident,A 76-year-old man from Beed district was killed and his 53-year-old cousin suffered severe injuries after their motorcycle was hit by a dumper at Alandi on Sunday night.,https://timesofindia.indiatimes.com/city/pune/senior-citizen-killed-in-road-accident/articleshow/100608920.cms
28,3 of family killed as MUV falls off bridge in Nashik,"Three people, including a four year-old-girl, of a family died when the multi-utility vehicle (MUV) in which they were travelling fell from a bridge on the Nandgaon-Manmad Road in the wee hours of Tuesday.",https://timesofindia.indiatimes.com/city/nashik/3-of-family-killed-as-muv-falls-off-bridge-on-nandgaon-manmad-road-in-nashik/articleshow/100611184.cms
29,"Are you a minor driving without a licence? Be ready to pay ₹25,000",,https://timesofindia.indiatimes.com/city/nagpur/are-you-a-minor-driving-without-a-licence-be-ready-to-pay-25000/articleshow/101120830.cms
30,Road crash deaths in Maharashtra down 9% in January-April compared to first 4 months of 2022,"Road crash-related deaths in Maharashtra reduced by 9% in the first four months of this year as compared to the same period in 2022, despite more and more vehicles being added to the streets.",https://timesofindia.indiatimes.com/city/mumbai/road-accident-deaths-in-state-down-9-in-jan-apr-compared-to-first-4-months-of-22/articleshow/100340663.cms
31,Dumper parked in middle of h’way kills biker,"A 32-year-old motorcyclist was killed when he rammed into a stationary dumper parked in the middle of the highway on LBS Marg in Mulund on Saturday. Police have booked the truck driver under relevant sections for flouting norms. The victim, Sarbajitsingh Bharaj, working with a private company, had got married last year June.",https://timesofindia.indiatimes.com/city/mumbai/dumper-parked-in-middle-of-hway-kills-biker/articleshow/101093417.cms
32,2 youngsters killed in Road accident,,https://timesofindia.indiatimes.com/city/nashik/2-youngsters-killed-in-road-accident/articleshow/100516169.cms
33,"6 killed, 10 injured in bus-truck collision in Maharashtra's Buldhana",As many as six people were killed and 10 others injured when a state transport bus collided with a container truck in Buldhana district of Maharashtra on Tuesday morning.,https://timesofindia.indiatimes.com/city/nagpur/6-killed-10-injured-in-bus-truck-collision-in-maharashtras-buldhana-mumbai-nagpur-highway/articleshow/100436137.cms
34,Man dies after bike rams stationary trailer,,https://timesofindia.indiatimes.com/city/nagpur/man-dies-after-bike-rams-stationary-trailer/articleshow/100951817.cms
35,Brain dead 3-yr-old among youngest organ donors in city,"The three-year-old Dombivli boy whose organs were donated after he was declared brain dead is among the youngest donors in Mumbai, said officials of the Zonal Transplant Coordination Centre (ZTCC), which distributes organs of brain stem deaths between hospitals.",https://timesofindia.indiatimes.com/city/mumbai/brain-dead-3-yr-old-among-youngest-organ-donors-in-city/articleshow/100951572.cms
36,"Witnesses in insurance claim fake, finds probe",,https://timesofindia.indiatimes.com/city/mumbai/witnesses-in-insurance-claim-fake-finds-probe/articleshow/100925281.cms
37,Traffic education should be a relentless process: Mumbai CP,,https://timesofindia.indiatimes.com/city/nashik/traffic-education-should-be-a-relentless-process-mumbai-cp/articleshow/100908772.cms
38,RTO tells 150 organizations to make helmets compulsory,,https://timesofindia.indiatimes.com/city/nashik/rto-tells-150-organizations-to-make-helmets-compulsory/articleshow/100836189.cms
39,"Pune: Two killed in separate accidents in Narhe, Warje",The Warje Malwadi police said the accident occurred on the lane going to Katraj.,https://timesofindia.indiatimes.com/city/pune/two-killed-in-separate-accidents-in-narhe-warje/articleshow/100808234.cms
40,Rs 47L for kin of man killed in ’18 rd accident,"Kin of a spare part supplier who was mowed down in an accident involving a tourist car in 2018, has been awarded Rs 47 lakh by the Thane MACT.",https://timesofindia.indiatimes.com/city/thane/47l-for-kin-of-man-killed-in-18-rd-accident/articleshow/100807350.cms
41,Actor deaths bring focus on ‘high-stress industry’,"A spate of deaths of young or middle-aged TV and Bollywood stars has evoked concern within film trade associations, sociologists and mental health experts.",https://timesofindia.indiatimes.com/city/mumbai/actor-deaths-bring-focus-on-high-stress-industry/articleshow/100736725.cms
42,Donated organs of brain dead man save 3 lives,,https://timesofindia.indiatimes.com/city/pune/donated-organs-of-brain-dead-man-save-3-lives/articleshow/100665089.cms
43,25 cops to get trained on issing e-challans,The city traffic police will impart training to 25 police personnel to issue e-challans to erring motorists who are found breaking traffic rules based on CCTV footage.,https://timesofindia.indiatimes.com/city/nashik/25-cops-to-get-trained-on-issing-e-challans/articleshow/100608667.cms
44,"Two Road accidents claim 4 lives in Daund, Baramati",,https://timesofindia.indiatimes.com/city/pune/two-road-accidents-claim-4-lives-in-daund-baramati/articleshow/100516497.cms
45,3 dead in Mumbai-Ahmedabad highway accident in Palghar,"Three men travelling on a motorbike died after their two-wheeler collided with a multi-utility vehicle (MUV) on the Mumbai-Ahmedabad highway in Maharashtra's Palghar district on Thursday, an official said. The victims were on their way from Harsul in Nashik district to Sanjan in Gujarat when they met with the accident around 11.30am.",https://timesofindia.indiatimes.com/city/thane/3-dead-on-mumbai-ahmedabad-highway-accident-in-palghar/articleshow/100507476.cms
46,Woman & 7-yr-old daughter killed as container rams them,,https://timesofindia.indiatimes.com/city/nashik/woman-7-yr-old-daughter-killed-as-container-rams-them/articleshow/100461555.cms
47,Highway cops distribute over 100 helmets in Dhule,,https://timesofindia.indiatimes.com/city/nashik/highway-cops-distribute-over-100-helmets-in-dhule/articleshow/100389831.cms
48,Woman killed in hit-and-run in Adgaon,,https://timesofindia.indiatimes.com/city/nashik/woman-killed-in-hit-and-run-in-adgaon/articleshow/100343312.cms
49,5 dead in SUV-tractor collision in Maharashtra's Sangli district,"At least five persons were killed and three injured when the SUV in which they were traveling collided with a tractor on Wednesday morning in western Maharashtra's Sangli district, police said. The accident took place near Miraj on Ratnagiri-Pandharpur road around 11am, a police officer said.",https://timesofindia.indiatimes.com/city/kolhapur/5-dead-in-suv-tractor-collision-in-maharashtras-sangli-district/articleshow/100303924.cms
50,Nashik police to be complainants in Road accident cases now,"Police commissioner Ankush Shinde has instructed the personnel of Nashik city police to ensure that, henceforth, the police are the complainants in Road accident cases and not the parties involved in the accident.",https://timesofindia.indiatimes.com/city/nashik/nashik-police-to-be-complainants-in-road-accident-cases-now/articleshow/100061379.cms
51,"1 killed, 22 injured as bus veers off road and falls into ditch in Pune",One person was killed and 22 suffered injuries when a bus veered off the road and fell into a ditch in Pune in the wee hours of Saturday.,https://timesofindia.indiatimes.com/city/pune/1-killed-22-injured-as-bus-veers-off-road-and-falls-into-ditch-in-pune/articleshow/99332976.cms
52,Maharashtra doctor couple donates organs of son killed in Road accident,"A doctor couple from Virar in Palghar district in Maharashtra has donated organs of their 30-year-old son who was killed in a motorcycle accident, an Indian Medical Association official said on Saturday. The donated organs will benefit at least 11 people, said IMA's Maharashtra secretary Dr Santosh Kadam.",https://timesofindia.indiatimes.com/city/navi-mumbai/maharashtra-doctor-couple-donates-organs-of-son-killed-in-road-accident/articleshow/100385323.cms
53,More vehicles on roads. More traffic violations. More deaths from accidents in Nagpur,"Of late, there’s been a steady increase in vehicular traffic and an equally worrisome rise in cases of violations and Road accidents.",https://timesofindia.indiatimes.com/city/nagpur/more-vehicles-on-roads-more-traffic-violations-more-deaths-from-accidents/articleshow/100044903.cms
54,Woman charred to death as autorickshaw catches fire after crash in Thane,An unidentified woman travelling in an autorickshaw was charred to death while its driver suffered injuries after the vehicle crashed into a road divider at Gaimukh on the Ghodbunder Road in Thane on Wednesday.,https://timesofindia.indiatimes.com/city/thane/woman-charred-to-death-as-autorickshaw-catches-fire-after-crash-in-thane/articleshow/99964612.cms
55,2 killed in separate Road accidents in Igatpuri,,https://timesofindia.indiatimes.com/city/nashik/2-killed-in-separate-road-accidents-in-igatpuri/articleshow/99283150.cms
56,"For the first time post-pandemic, Road accident victim’s all organs donated in Nagpur","After a 27-year-old youth from Kalmeshwar, who met with a Road accident on April 19 died of head injuries on April 22, his family decided to donate his organs to needy patients.",https://timesofindia.indiatimes.com/city/nagpur/for-the-first-time-post-pandemic-road-accident-victims-all-organs-donated/articleshow/99718582.cms
57,"Nagpur-Mumbai Samruddhi Expressway: 100 days, 900 accidents & 31 fatalities","In the first 100 days since its inauguration, the Samruddhi Expressway has witnessed as many as 900 accidents, including many fatal. A study conducted by Regional Transport Office of Maharashtra government revealed that these accidents had claimed 31 lives till March 20, 2023.",https://timesofindia.indiatimes.com/city/nagpur/samruddhi-100-days-900-accidents-31-fatalities/articleshow/98880781.cms
58,Department heads to also face action if bikers visit govt office sans helmets,"Next time any government office across Maharashtra has a two-wheeler rider visitor without wearing a helmet, the office or institute head may also face action under the Motor Vehicles Act.",https://timesofindia.indiatimes.com/city/nagpur/dept-heads-to-also-face-action-if-bikers-visit-govt-office-sans-helmets/articleshow/99599762.cms
59,Brain-dead woman gives life to three,,https://timesofindia.indiatimes.com/city/pune/brain-dead-woman-gives-life-to-three/articleshow/99528160.cms
60,"Fatal accidents drop 31% in city, rise 67% in Gadchiroli",,https://timesofindia.indiatimes.com/city/nagpur/fatal-accidents-drop-31-in-city-rise-67-in-gadchiroli/articleshow/99527784.cms
61,Rise in fatal accidents in Maharashtra’s Jalgaon district last year,"The number of fatal accidents in North Maharashtra’s Jalgaon district witnessed a marginal rise in the year 2022 as compared to the previous year, said senior officials from the regional transport office (RTO) on Friday.",https://timesofindia.indiatimes.com/city/nashik/rise-in-fatal-accidents-in-jalgaon-dist-last-yr/articleshow/99507093.cms
62,"Hit by car, biker killed on Pune's Katraj-Dehu Road bypass","In a hit-and-run accident, a motorcyclist (49) was killed after he was hit by a car at Hinjewadi along the Katraj-Dehu Road bypass around 11.30am on Wednesday afternoon.",https://timesofindia.indiatimes.com/city/pune/hit-by-car-biker-killed-on-punes-katraj-dehu-road-bypass/articleshow/98529239.cms
63,No seatbelt: Licence of 515 drivers suspended in Nagpur,"Driving four-wheelers without fastening seatbelts? Beware, your driving licence can be suspended. The Regional Transport Office (RTO) has started suspending licence of those found driving without strapping seatbelts. Wearing seatbelts while driving a four-wheeler is mandatory as per rules.",https://timesofindia.indiatimes.com/city/nagpur/no-seatbelt-licence-of-515-drivers-suspended/articleshow/99450227.cms
64,52 dead in Road accidents in Nashik in first 3 months of 2023,"A total of 52 people, including a dozen pedestrians, died in Road accidents in the city in the first three months of 2023, the traffic police said on Tuesday.",https://timesofindia.indiatimes.com/city/nashik/52-dead-in-road-accidents-in-nashik-in-first-3-months-of-2023/articleshow/99775587.cms
65,"Amar Mahal, other junctions to focus on pedestrian needs",,https://timesofindia.indiatimes.com/city/mumbai/amar-mahal-other-junctions-to-focus-on-pedestrian-needs/articleshow/99310270.cms
66,"Woman, senior citizen among 4 killed in separate Road accidents",,https://timesofindia.indiatimes.com/city/nagpur/woman-senior-citizen-among-4-killed-in-separate-road-accidents/articleshow/99701464.cms
67,4 dead after compact SUV hits road divider before crashing into truck on Pune-Mumbai expressway,Four persons died on the spot when the compact SUV they were travelling in first hit a median before veering to the extreme left to crash into a stationary truck near the Urse toll post around 40km from Pune on the Pune-Mumbai expressway on Thursday evening.,https://timesofindia.indiatimes.com/city/pune/4-dead-after-compact-suv-hits-road-divider-before-crashing-into-truck-on-pune-mumbai-expressway/articleshow/99305103.cms
68,Woman out on morning walk suffers multiple fractures as speeding car hits her in Thane,"Police said that a 42-year-old woman was struck by a speeding vehicle while she was out for a morning walk in Thane, resulting in multiple fractures. The incident occurred on Monday, two weeks after a CEO of a tech firm was fatally hit by a speeding car while on her morning walk in Mumbai's Worli area.",https://timesofindia.indiatimes.com/city/thane/woman-out-on-morning-walk-suffers-multiple-fractures-as-speeding-car-hits-her-in-thane/articleshow/99234959.cms
69,At least one dead in Road accident at Mumbai-Agra highway,,https://timesofindia.indiatimes.com/city/nashik/at-least-one-dead-in-road-accident-at-mumbai-agra-highway/articleshow/99317327.cms
70,"Remarriage can't deny widow compensation for husband's death in Road accident, says Bombay HC","The remarriage of a widow should not deny her compensation under the Motor Vehicles Act (MVA) for her husband's death in accident, said the Bombay High Court recently while upholding an order of an accidents claims tribunal.",https://timesofindia.indiatimes.com/city/mumbai/remarriage-cant-deny-widow-compensation-for-husbands-death-in-road-accident-says-bombay-hc/articleshow/99158309.cms
71,More than 50% vehicles not insured: Govt,,https://timesofindia.indiatimes.com/city/mumbai/more-than-50-vehicles-not-insured-govt/articleshow/98846284.cms
72,5 dead & 5 hurt in 3 separate Road accidents in Nashik city & rural,Five people were killed and five others were injured in three separate Road accidents in Nashik city and parts of the rural areas on Tuesday and Wednesday.,https://timesofindia.indiatimes.com/city/nashik/5-dead-5-hurt-in-3-separate-road-accidents-in-nashik-city-rural/articleshow/96923595.cms
73,Newly-wed dies after tyre burst in Maharashtra's Boisar,A 23-year-old newly-wed man was killed and his driver was injured after his car hit a tree following a tyre burst in Boisar early Friday.,https://timesofindia.indiatimes.com/city/mumbai/newly-wed-dies-after-tyre-burst/articleshow/98573539.cms
74,Most Nashik city roads yet to get proper accident-prevention features,"Most of the roads and traffic junctions in the city are without zebra crossings, cat’s eye (reflectors), among other infrastructure necessary for preventing Road accidents.",https://timesofindia.indiatimes.com/city/nashik/most-nashik-city-roads-yet-to-get-proper-accident-prevention-features/articleshow/98439470.cms
75,17-year-old student killed in Road accident,,https://timesofindia.indiatimes.com/city/kolhapur/17-year-old-student-killed-in-road-accident/articleshow/98056196.cms
76,"Transgender person dies, two sisters injured in separate Road accidents in Bhiwandi","In two separate Road accidents, a transgender person was killed while two sisters were seriously injured in Bhiwandi.",https://timesofindia.indiatimes.com/city/thane/transgender-person-dies-two-sisters-injured-in-separate-road-accidents-in-bhiwandi/articleshow/96652280.cms
77,New lease of life for 5 after 19-year-old’s organs donated in Pune,"A farm labourer (41) donated the vital organs of her 19-year-old brain-dead son, including his heart, lungs, liver, pancreas, and kidneys at the DY Patil Medical College and Hospital in Pimpri on Thursday.",https://timesofindia.indiatimes.com/city/pune/new-lease-of-life-for-5-after-19-year-olds-organs-donated/articleshow/98223500.cms
78,"10 dead, 22 injured as bus carrying pilgrims to Shirdi collides with truck in Nashik; pall of gloom in Ambernath",The deceased were travelling by a luxury bus to Shirdi. The injured have been shifted to the Sinnar Rural Hospital and a private hospital in Sinnar.,https://timesofindia.indiatimes.com/city/nashik/10-pilgrims-killed-in-collision-between-bus-and-truck-in-maharashtras-nashik/articleshow/96955306.cms
79,Elderly man dies in Road accident,"A 65-year-old man died after being knocked down by a truck driver in Nashik on Friday. Kiran Mahadu Jadhav, a resident of Mhasrul, was identified as the victim based on the complaint of his son. The truck driver, identified as Rajesh, has been arrested and police are investigating the case.",https://timesofindia.indiatimes.com/city/nashik/elderly-man-dies-in-road-accident/articleshow/96842711.cms
80,Two killed in separate Road accidents,"Two people were killed in two separate Road accidents in Nashik on Monday and Tuesday. The accidents were reported at the Gangapur and Panchavati police stations. The Panchavati police said that 42-year-old Umesh Yadav, a resident of Adgaon and a native of Fatehpur in the Gaya District of Bihar, was speeding his bike on the flyover at Mumbaiagra Highway at around 1am on Tuesday when he lost control of his bike and rammed into the road divider. He was taken to Nashik Civil Hospital where he was declared brought dead. 25-year-old Atul Kumavat, a resident of Trimbak Road, was riding his bike from Utkarsha Nagar when he rammed his vehicle into the road divider at around 1130pm on Monday. Kumavat was rushed to the Civil Hospital where he was declared brought dead. Police officials said that overspeeding was one of the main reasons behind the accidents in both these cases.",https://timesofindia.indiatimes.com/city/nashik/two-killed-in-separate-road-accidents/articleshow/96752146.cms
81,"Over 1,000 officials from Maharashtra get training to collect scientific data at road crash sites","Over 1,050 officials from police, RTO and PWD departments in Maharashtra are now trained to gather information and detailed data scientifically from any road crash site across Maharashtra, deputy transport commissioner (road safety) Bharat Kalaskar said.",https://timesofindia.indiatimes.com/city/mumbai/over-1000-officials-from-maharashtra-get-training-to-collect-scientific-data-at-road-crash-sites/articleshow/96628585.cms
