sno,h,sub_h,link
292,"Mishap case fast-tracked, Rs 42 lakh payout for kin",The extended Lok Adalat held in the Thane district court under the aegis of the District Legal Services Authority (DSLA) recently settled a motor accident case going back to 2011 under the fast-track system of mutual understanding. It awarded the widow and son of the deceased Rs 42 lakh.,https://timesofindia.indiatimes.com/city/thane/mishap-case-fast-tracked-rs-42-lakh-payout-for-kin/articleshow/45567608.cms
293,Second leopard dies on road in 2 months,A leopard died after being knocked down by a vehicle at the Laling Ghat road in Dhule early on Tuesday morning.,https://timesofindia.indiatimes.com/city/nashik/second-leopard-dies-on-road-in-2-months/articleshow/42748359.cms
294,Complaint against Nitin Gadkari for violating traffic rule,"Recently, after the death of Gopinath Munde in a Road accident, Gadkari had stressed on the need to change Motor Vehicles Act, and asked officials to strictly implement the laws against traffic rule violators.",https://timesofindia.indiatimes.com/city/nagpur/complaint-against-nitin-gadkari-for-violating-traffic-rule/articleshow/36452957.cms
295,"Mumbai’s internal roads see 50 accidents, 10 deaths every week",,https://timesofindia.indiatimes.com/city/mumbai/citys-internal-roads-see-50-accidents-10-deaths-every-wk/articleshow/56383085.cms
296,Protest against decision to disallow drunk passengers in Delhi Metro,"Activist Prince Singhal, has written to the Union home minister Sushil Kumar Shinde seeking his intervention to scrap the recent move by CISF barring drunk passengers from travelling in metros as such a move would result in several more drunk driving accidents and fatalities on our roads.",https://timesofindia.indiatimes.com/city/mumbai/protest-against-decision-to-disallow-drunk-passengers-in-delhi-metro/articleshow/20088378.cms
297,CM Devendra Fadnavis' tweet wakes up authorities to help paraplegic doctor,"Authorities on Wednesday scrambled to ensure Alaknanda Vaidya was transferred back to Pune from a government hospital in Baramati, a day after TOI reported about the plight of the single parent and paraplegic doctor .",https://timesofindia.indiatimes.com/city/pune/cm-devendra-fadnavis-tweet-wakes-up-authorities-to-help-paraplegic-doctor/articleshow/54340898.cms
298,"In a first, simulator to be used to train school tourist bus drivers","For the first time ever, Mumbai will have its very own simulator for training school and tourist bus drivers to ensure .",https://timesofindia.indiatimes.com/city/mumbai/in-a-first-simulator-to-be-used-to-train-school-tourist-bus-drivers/articleshow/17838607.cms
299,Road digging won’t be allowed in Pune after June 1: PMC chief,"All emergency road-digging and restoration works in the city will be completed by May-end and the civic administration will not allow digging of roads for any work after June 1, municipal commissioner Kunal Kumar has said.",https://timesofindia.indiatimes.com/city/pune/road-digging-wont-be-allowed-in-pune-after-june-1-pmc-chief/articleshow/47390972.cms
300,Kolhapur records state highest average of emergencies tackled in a day,The district has reported the highest average in the state for the number of emergency calls received daily as against the number of ambulances.,https://timesofindia.indiatimes.com/city/kolhapur/kolhapur-records-state-highest-average-of-emergencies-tackled-in-a-day/articleshow/48408505.cms
301,Most people killed on roads are pedestrians,"Pedestrians were the biggest victims in Road accidents in the city this year, followed by motorcycle riders.",https://timesofindia.indiatimes.com/city/mumbai/most-people-killed-on-roads-are-pedestrians/articleshow/27760821.cms
302,‘Health insurance cover too low to benefit patients’,Medical fraternity of the city is disappointed with the budget giving little attention to the health sector yet again.,https://timesofindia.indiatimes.com/city/nagpur/health-insurance-cover-too-low-to-benefit-patients/articleshow/46415477.cms
303,Cops say traffic violations declining. Really?,There is a stark difference between the blatant violation of traffic rules by city motorists and the number of challans issued this year.,https://timesofindia.indiatimes.com/city/nagpur/cops-say-traffic-violations-declining-really/articleshow/56208431.cms
304,Drive against tinted glass on 4-wheelers from Monday,The traffic police is all set to clamp down on the use of black films on windscreens and windows of all four-wheelers and luxury buses in a special drive from Monday.,https://timesofindia.indiatimes.com/city/pune/drive-against-tinted-glass-on-4-wheelers-from-monday/articleshow/45322948.cms
305,15-year-old girl on cycle mowed down by truck,A 15-year-old girl lost her life in a Road accident caused by poor condition of roads and a pothole at Old Pardi toll plaza turning point on Tuesday morning.,https://timesofindia.indiatimes.com/city/nagpur/15-year-old-girl-on-cycle-mowed-down-by-truck/articleshow/27551106.cms
306,Digging of roads continues in Pune despite stop-work orders,Various telecom companies and agencies continue to dig roads in the city flouting the deadline set by the Pune Municipal Corporation (PMC) to finish all such works by April 30.,https://timesofindia.indiatimes.com/city/pune/digging-of-roads-continues-in-pune-despite-stop-work-orders/articleshow/47217946.cms
307,Rs 56L payout for kin of banker who died in accident,"Srinivasalu Nagineni (32), hen an assistant manager with ICICI bank, was riding pillion on a motorcycle when a speeding dumper rammed the wo­wheeler from behind. Nagineni's colleague Suresh Ahire, who was riding the bike, was also killed in the accident on the Pune­Link Road close to Chakki Naka. The family of he deceased approached the tribunal, demanding compensation from the owner of the dumper and Oriental Insurance Company , which had insured he heavy vehicle.",https://timesofindia.indiatimes.com/city/thane/rs-56l-payout-for-kin-of-banker-who-died-in-accident/articleshow/49213536.cms
308,"HC asks man to pay 50,000 to quash FIR against minor son","Sending out a tough message against under-age driving, the Bombay High Court has directed a Lokhandwala resident to shell out Rs 50,000 as costs, if he wants an FIR against his minor son for rash driving quashed.",https://timesofindia.indiatimes.com/city/mumbai/hc-asks-man-to-pay-50000-to-quash-fir-against-minor-son/articleshow/53777792.cms
309,"HC fines man Rs 50,000 for allowing minor son to drive","Sending out a tough message against under-age driving, the Bombay High Court has directed a Lokhandwala resident to shell out Rs 50,000 as costs, if he wants an FIR against his minor son for rash driving quashed. A division bench of Justice Naresh Patil and Justice Prakash Naik directed Mahesh Chavan to pay the money to Tata Memorial Hospital and Cancer Research Institute, and submit the receipt in order for the criminal proceedings to be dropped.",https://timesofindia.indiatimes.com/city/mumbai/hc-fines-man-rs-50000-for-allowing-minor-son-to-drive/articleshow/53787584.cms
310,"2 pilgrims die, 11 hurt near Kasara","In second such incident in a span of a fortnight, two pilgrims were killed and 11 others injured in a Road accident that took place on the Mumbai-Agra highway on early Monday morning.",https://timesofindia.indiatimes.com/city/nashik/2-pilgrims-die-11-hurt-near-kasara/articleshow/49148380.cms
311,One million cars choke Mumbai roads,"The survey report, tabled in the state assembly last Friday, indicates that despite the increase in vehicles, fatalities and injuries in Road accidents were declining in the past two years in Mumbai and the rest of the state.",https://timesofindia.indiatimes.com/city/mumbai/private-cars-and-cabs-cross-the-million-mark-in-city-eco-survey/articleshow/57722367.cms
312,Nashik RTO comes up with a song to boost helmet use,"Nashik Regional Transport Office (RTO) has come out with a Marathi song, which would soon be played at different events in city-based colleges.",https://timesofindia.indiatimes.com/city/nashik/nashik-rto-comes-up-with-a-song-to-boost-helmet-use/articleshow/50088905.cms
313,"Cops spread road safety awareness through SMS, email",Over six lakh people in the district are getting road safety messages and traffic alerts under an initiative of the traffic police who have tied up with the BSNL to create awareness on road safety.,https://timesofindia.indiatimes.com/city/pune/cops-spread-road-safety-awareness-through-sms-email/articleshow/28859624.cms
314,NMMC rolls out 24X7 help for stray animals,"The Navi Mumbai Municipal Corporation (NMMC) started a 24-hour animal ambulance service in the city on Friday to help animals in distress, especially stray dogs and cats.",https://timesofindia.indiatimes.com/city/navi-mumbai/nmmc-rolls-out-24x7-help-for-stray-animals/articleshow/39435975.cms
315,"Identify dangerous spots, take steps to prevent mishaps: Reetesh Kumar, Inspector General of Police, Kolhapur","Accident prone spots in the city and on highways should be identified and steps should be taken to minimize mishaps at these places, said Reetesh Kumar, Inspector General of Police, Kolhapur range.",https://timesofindia.indiatimes.com/city/kolhapur/identify-dangerous-spots-take-steps-to-prevent-mishaps-reetesh-kumar-inspector-general-of-police-kolhapur/articleshow/46036758.cms
316,Woman kills husband,"A 30-year-old woman strangulated her husband to death with the help of her brothers, sister and brother-in-law in Warora. Later they dumped the body of Dnyaneshwar Wadaskar (45) on Warora-Chimur Road to make it appear like a case of .",https://timesofindia.indiatimes.com/city/nagpur/woman-kills-husband/articleshow/49941406.cms
317,Five killed in two mishaps at Sinnar,Five persons were killed in two Road accidents in Sinnar.A Scorpio skidded off the road at Sonambe on the Sinnar-Ghoti highway as the driver felt asleep.,https://timesofindia.indiatimes.com/city/nashik/five-killed-in-two-mishaps-at-sinnar/articleshow/14196417.cms
318,Lorry operators cry foul over mandatory speed governors,"Lorry operators in Kolhapur are irked over the state's decision to make the speed governor mandatory on all heavy vehicles. They have also demanded the motor vehicle department should revoke this compulsion. The city's regional transport office (RTO), however, said that the decision is state-wide and cannot be discontinued only for Kolhapur.",https://timesofindia.indiatimes.com/city/kolhapur/lorry-operators-cry-foul-over-mandatory-speed-governors/articleshow/51694445.cms
319,Mumbai Police file FIR against rumor mongers,"After registering first FIR against the rumour mongers in Bhoiwada police station, the city police on Monday said their primary target is to arrest the perpetrators who spread rumours and attempted to harm city's law and order.",https://timesofindia.indiatimes.com/city/mumbai/mumbai-police-file-fir-against-rumor-mongers/articleshow/45857234.cms
320,"Yes, the city is accident prone","In a recent report released by the Transport Research Wing of the Union ministry of road transport and highways, Nagpur features high on the list of 23 cities that were surveyed as most prone to accidents.",https://timesofindia.indiatimes.com/city/nagpur/yes-the-city-is-accident-prone/articleshow/6891535.cms
321,Cyclists aim to drive home road safety message this Sunday,"Recently, an experiment in Europe had both pedestrians and cyclists carry a wireframe the size of a car.",https://timesofindia.indiatimes.com/city/mumbai/cyclists-aim-to-drive-home-road-safety-message-this-sunday/articleshow/45814620.cms
322,Shame: Maharashtra's new weapon against drunken driving,"While more than 1,000 such offenders are caught every day across Maharashtra, the public shaming campaign seems to be making a difference where the initiative has already been launched. Results can be seen in cities like Nagpur, where the number of offenders has declined after public shaming.",https://timesofindia.indiatimes.com/city/mumbai/shame-maharashtras-new-weapon-against-drunken-driving/articleshow/51572253.cms
323,Protest at Vashi toll naka today,Brace for traffic disruptions near Vashi toll naka on Monday as several transporters affiliated to the Shiv Sena union will stage a sit-in strike to protest against overloading trucks.,https://timesofindia.indiatimes.com/city/navi-mumbai/protest-at-vashi-toll-naka-today/articleshow/27446162.cms
324,Biker dies in road mishap,"Sandip Tile (24), of Shindegaon died in a Road accident on the Nashik Road flyover on April 25.",https://timesofindia.indiatimes.com/city/nashik/biker-dies-in-road-mishap/articleshow/12887835.cms
325,"Techie kills ex-wife in front of daughter, dies in car crash",,https://timesofindia.indiatimes.com/city/pune/techie-kills-ex-wife-in-front-of-daughter-dies-in-car-crash/articleshow/55396043.cms
326,"Now, Parel woman caught driving drunk","Three days after a drunk woman killed two persons in Road accident on the Eastern Freeway, the traffic police during an anti drunken drive found a another woman driving her car in drunken state. The incident took place at around 12.10 am on Saturday near Zoo at Byculla.",https://timesofindia.indiatimes.com/city/mumbai/now-parel-woman-caught-driving-drunk/articleshow/47660795.cms
327,Insurance firm directed to pay 21 lakh compensation,"The Motor Accident Claims Tribunal (MACT) has directed an insurance company to pay Rs 21 lakh compensation to the family members of an accident victim ruling that the firm ""cannot escape liability by seeking benefit of its own wrong"".",https://timesofindia.indiatimes.com/city/pune/insurance-firm-directed-to-pay-21-lakh-compensation/articleshow/49680917.cms
328,Cops conduct drive to keep tabs on mischief mongers,Police personnel descended on the city roads in large numbers on Sunday evening for conducting to keep a check on mischief mongers and drunk driving. Senior officials said surprise nakabandis would be a regular feature to keep street crimes under control.,https://timesofindia.indiatimes.com/city/nashik/cops-conduct-drive-to-keep-tabs-on-mischief-mongers/articleshow/47593662.cms
329,Married woman ends life,"Married just five months ago, 23-year-old Sapna Wankhede committed suicide by hanging herself to the ceiling hook at her Buddha Nagar residence on Friday afternoon.",https://timesofindia.indiatimes.com/city/nagpur/married-woman-ends-life/articleshow/6762068.cms
330,Reply on non-use of high security number plates : HC tells State,Bombay High Court hasasked the State government to reply to a contempt petition for non-implementation ofthe high security number plates for vehicles in Maharashtra.,https://timesofindia.indiatimes.com/city/mumbai/reply-on-non-use-of-high-security-number-plates-hc-tells-state/articleshow/26113256.cms
331,Incomplete road a death trap for motorists,"The stretch between Sinnar Phata and Shinde on the Nashik-Pune highway has become a death-trap for motorists - the rains have only worsened the undone road where construction had been halted due to technical and legal tangles over tree cutting, causing much inconvenience to the commuters.",https://timesofindia.indiatimes.com/city/nashik/incomplete-road-a-death-trap-for-motorists/articleshow/53075557.cms
332,"Three killed, two hurt in mishap",Three persons died and two were injured in a Road accident near Mandala village on Arvi-Talegaon road on Saturday night around 10pm.,https://timesofindia.indiatimes.com/city/nagpur/three-killed-two-hurt-in-mishap/articleshow/12928638.cms
333,Car injures mob in Pune after clash over reckless driving,,https://timesofindia.indiatimes.com/city/pune/car-injures-mob-in-pune-after-clash-over-reckless-driving/articleshow/55042290.cms
334,Young cop on dutydies of heart attack,"A young constable on duty at Wadi police station died of cardiac arrest on Tuesday midnight.The deceased, identified as Lokesh Chore (26), was posted at Wadi just six months back.",https://timesofindia.indiatimes.com/city/nagpur/young-cop-on-dutydies-of-heart-attack/articleshow/25720503.cms
335,Thane cops in dark on video rule for accident probe,"The Thane police are clueless about the government orders that permit them to take account of witnesses in a Road accident through video-recording, even six months after the notification was issued.",https://timesofindia.indiatimes.com/city/thane/thane-cops-in-dark-on-video-rule-for-accident-probe/articleshow/36065794.cms
336,Dearth of quality drivers in Mumbai: Transport commissioner,"There is a shortage of quality drivers in the city, especially for taxis, buses and trucks, said state transport commissioner VN More.",https://timesofindia.indiatimes.com/city/mumbai/dearth-of-quality-drivers-in-mumbai-transport-commissioner/articleshow/25290562.cms
337,Vashi hospital to teach cops basic life support skills,"The city police commissioner, K L Prasad, has initiated a programme where officials from Fortis Hospital, Vashi will train cops in basic life support and Cardiopulmonary resuscitation.",https://timesofindia.indiatimes.com/city/navi-mumbai/vashi-hospital-to-teach-cops-basic-life-support-skills/articleshow/35795258.cms
338,Close shave for Congress MLA from Gadchiroli Dr Namdeo Usendi,Congress MLA from Gadchiroli Dr Namdeo Usendi had a providential escape in a Road accident near Brahmapuri in Chandrapur district on Friday night.,https://timesofindia.indiatimes.com/city/nagpur/close-shave-for-congress-mla-from-gadchiroli-dr-namdeo-usendi/articleshow/19013501.cms
339,HC asks government to inform on licence rules for teenagers in other states,,https://timesofindia.indiatimes.com/city/nagpur/hc-asks-government-to-inform-on-licence-rules-for-teenagers-in-other-states/articleshow/52920021.cms
340,"Spanish priest (90), here since 1948, wants to die an Indian","A Spanish Jesuit priest, Fr Federico Sopena Gusi, who will turn 90 next March, has a strong desire “to die as an Indian citizen on Indian soil’’. He visited the Mumbai suburban district collector’s office in Bandra on Thursday to complete the administrative process.",https://timesofindia.indiatimes.com/city/mumbai/spanish-priest-90-here-since-1948-wants-to-die-an-indian/articleshow/49278481.cms
341,Woman gets Rs 22.90 lakh for son’s death in mishap,"A Motor Accident Claims Tribunal (MACT) here has directed the owner of a jeep and its insurer to jointly pay Rs 22.90 lakh as compensation to a woman for the death of her 27-year-old son in a Road accident at Retwadi in Khed taluka on November 15, 2012.",https://timesofindia.indiatimes.com/city/pune/woman-gets-rs-22-90-lakh-for-sons-death-in-mishap/articleshow/49250296.cms
342,"Blood spills on Palm Beach Road again, 4 die in two mishaps at Sanpada, Vashi",Four men were killed in two accidents on Palm Beach Road at Vashi and Sanpada early on Friday while it was raining.,https://timesofindia.indiatimes.com/city/mumbai/blood-spills-on-palm-beach-road-again-4-die-in-two-mishaps-at-sanpada-vashi/articleshow/48209536.cms
343,"Wear helmet, save lives: City police chief",Helmets can save lives. And the police commissioner agrees.City police chief Ankush Dhanvijay has appealed to citizens to make it a point to wear helmets while driving two-wheelers.,https://timesofindia.indiatimes.com/city/nagpur/wear-helmet-save-lives-city-police-chief/articleshow/7484797.cms
344,‘Save 100 lives’ to help reduce road mishaps,"About 400 people die in roads accidents in the city every year. To help minimize this number by at least ‘100’, The Save Pune Traffic Movement has launched a programme — ‘Save 100 Lives’.",https://timesofindia.indiatimes.com/city/pune/save-100-lives-to-help-reduce-road-mishaps/articleshow/11370134.cms
345,Tiger found dead near forest nursery was hit by vehicle,,https://timesofindia.indiatimes.com/city/nagpur/tiger-found-dead-near-forest-nursery-was-hit-by-vehicle/articleshow/50872745.cms
346,"Dialysis patients to get Rs 25,000 aid","The Pune Municipal Corporation (PMC) has proposed to provide one-time assistance of Rs 25,000 each to dialysis patients whose annual income is less than Rs 1 lakh.",https://timesofindia.indiatimes.com/city/pune/dialysis-patients-to-get-rs-25000-aid/articleshow/6881228.cms
347,Govt to develop dry port in Pimpri Chinchwad,"The Centre will develop a dry port in Pimpri Chinchwad to enable export, Nitin Gadkari, Union minister for road transport and highways, said on Saturday.",https://timesofindia.indiatimes.com/city/pune/govt-to-develop-dry-port-in-pimpri-chinchwad/articleshow/45008645.cms
348,"150 calls to 108 service, and counting","108 service, the sole medical emergency lifeline on the second Parvani day, received 155 calls between 12 am and 4 pm. Senior medical officers handling the 108 ambulance service calls said the number could go well beyond 200 till midnight.",https://timesofindia.indiatimes.com/city/nashik/150-calls-to-108-service-and-counting/articleshow/48952348.cms
349,Maharashtra government relaxes recruitment rules for assistant inspectors for transport department,"The state government has relaxed recruitment rules for appointment of biggest ever 1000 assistant inspectors (motor vehicles) in one phase of absorption of manpower, in the 50 transport offices.",https://timesofindia.indiatimes.com/city/navi-mumbai/maharashtra-government-relaxes-recruitment-rules-for-assistant-inspectors-for-transport-department/articleshow/56379477.cms
350,"Four killed, three injured in day-break accidents","Four persons were killed and three others injured in two Road accidents early on Sunday, even as the city police and the transport officials were busy celebrating the annual road safety week.",https://timesofindia.indiatimes.com/city/nashik/four-killed-three-injured-in-day-break-accidents/articleshow/45937986.cms
351,"Traffic violators, speeders may lose driving licence",,https://timesofindia.indiatimes.com/city/nagpur/traffic-violators-speeders-may-lose-driving-licence/articleshow/47806881.cms
352,21 accidents: Brihanmumbai Electric Supply and Transport to pay Rs 40 lakh compensation,The loss-making Brihanmumbai Electric Supply and Transport (BEST) undertaking will have to pay a whopping Rs 40 lakh in compensation to the next of kin of those who died or were seriously injured in 21 major Road accidents in the past six years.,https://timesofindia.indiatimes.com/city/mumbai/21-accidents-brihanmumbai-electric-supply-and-transport-to-pay-rs-40-lakh-compensation/articleshow/14857396.cms
353,"SC liquor ban along highways applies only to vends, not hotels, bars: Ex-top judges","The Supreme Court ban on liquor sale along highways is limited to retail shops and vends, and does not apply to hotels, restaurants and bars, according to former Supreme Court Justice B N Srikrishna and former Delhi high court Chief Justice A P Shah",https://timesofindia.indiatimes.com/city/mumbai/scs-liquor-ban-applies-only-to-vends-not-hotels-bars-ex-top-judges/articleshow/58016785.cms
354,Youth dies in road mishap,"Suyog Meshram, 18, a student of Hislop College was killed on the spot in a Road accident on Gowari flyover on Thursday night around 11 pm.",https://timesofindia.indiatimes.com/city/nagpur/youth-dies-in-road-mishap/articleshow/8121752.cms
355,Man dies after bike hits stone,A twenty-one-year-old man died in a Road accident after his two-wheeler hit a stone on the road near Gittikhadan Square in the wee hours of Friday.,https://timesofindia.indiatimes.com/city/nagpur/man-dies-after-bike-hits-stone/articleshow/18081612.cms
356,Camera captures BMW zipping past Mumbai-Pune Expressway at 174 km/hr,It's more than double the speed limit of 80 km/hr prescribed for the Pune-Mumbai Expressway; two-day experiment with single camera on ground fares hundred times better at detecting overspeeders than drones,https://timesofindia.indiatimes.com/city/pune/camera-captures-bmw-zipping-past-mumbai-pune-expressway-at-174-km/hr/articleshow/54163600.cms
357,Accident claim of Rs 20 lakh settled through mediation,"The Motor Accident Claims Tribunal (MACT), Pune has settled a claim petition through mediation and awarded a compensation of Rs 20 lakh to family members of a 30-year old man who was killed in a Road accident in 2012.",https://timesofindia.indiatimes.com/city/pune/accident-claim-of-rs-20-lakh-settled-through-mediation/articleshow/21069882.cms
358,Bombay high court upholds Rs 38 lakh payout with 9% interest to family of IIT engineer killed in accident,The court rejected an application filed by the insurance firm that alleged that the accidents claims tribunal had erred in calculating Harshwardhan Sharma’s monthly salary at the time of the accident and also awarded a higher interest rate,https://timesofindia.indiatimes.com/city/mumbai/bombay-high-court-upholds-rs-38-lakh-payout-with-9-interest-to-family-of-iit-engineer-killed-in-accident/articleshow/48658628.cms
359,'Pay 38L to kin of IIT engineer killed in accident',"Eleven years after a 51-year-old IIT engineer from Andheri died in a Road accident in Gujarat, the Bombay high court upheld an order asking the insurance company to pay around Rs 38 lakh, along with 9% interest to his wife, son and widowed mother.",https://timesofindia.indiatimes.com/city/mumbai/pay-38l-to-kin-of-iit-engineer-killed-in-accident/articleshow/48659989.cms
360,"Traffic indiscipline: Overspeeding cases highest in Hinjewadi, Warje","Hinjewadi is known not only for its IT park but also for traffic congestion, lack of road infrastructure and now - in a latest - for overspeeding of vehicles.",https://timesofindia.indiatimes.com/city/pune/traffic-indiscipline-overspeeding-cases-highest-in-hinjewadi-warje/articleshow/48646655.cms
